{
  "schema_version": "1.0.0",
  "context_id": "context:fixture-growth-plan",
  "exported_at": "2026-08-25T10:00:00Z",
  "context_fingerprint": {
    "algorithm": "sha256",
    "digest": "37b9a544d3d7832c87ab6987b198a58484ad141632575823847c1fe0badf1f91",
    "canonicalization": "pando-preparation-context-v1"
  },
  "goal": {
    "kind": "growth_plan",
    "title": "Strengthen practical Python engineering"
  },
  "availability": {
    "timezone": "Asia/Jerusalem",
    "weekly_minutes": 300,
    "unavailable_dates": [],
    "constraints": ["Prefer three focused sessions per week."]
  },
  "catalog": {
    "catalog_version": "1.0.0",
    "supported_competencies": [
      {
        "competency_id": "competency:python.parsing",
        "title": "Parse structured text with Python"
      }
    ]
  },
  "competency_summaries": [
    {
      "competency_ref": {
        "kind": "canonical",
        "competency_id": "competency:python.parsing",
        "catalog_version": "1.0.0"
      },
      "dimensions": [
        {
          "dimension": "Application",
          "state": "Unknown",
          "confidence": "unknown"
        }
      ]
    }
  ],
  "growth_plan": {
    "title": "Engineering growth",
    "tracks": [
      {
        "track_id": "track:python-engineering",
        "title": "Practical Python engineering",
        "priority": 80,
        "protected_weekly_minutes": 180
      }
    ]
  }
}
